{
	"$schema": "./typst-docs-web/metadata.schema.json",
	"language": "ja-JP",
	"version": "0.13.1",
	"typstOfficialUrl": "https://typst.app",
	"typstOfficialDocsUrl": "https://typst.app/docs/",
	"githubOrganizationUrl": "https://github.com/typst-jp",
	"githubRepositoryUrl": "https://github.com/typst-jp/docs",
	"discordServerUrl": "https://discord.gg/9xF7k4aAuH",
	"originUrl": "https://typst-jp.github.io/",
	"basePath": "/docs/",
	"displayTranslationStatus": true
}
